{
  "$schema":"https://json-schema.org/draft/2020-12/schema","$id":"historical-dataset.schema.json","type":"object","additionalProperties":false,
  "required":["contractVersion","dataset","periods","capturePolicy","parserVersions","sourcePresentations","matcher","days","totals","structuralRetention","concentration","quality","warnings","generatedAt","manifestHash"],
  "properties":{
    "contractVersion":{"const":"1.0"},"dataset":{"type":"object"},"periods":{"type":"object"},
    "capturePolicy":{"type":"object","required":["version","concurrency","firstValidResponsePinned","minimumPauseMs","timeoutMs","maxBytes","maxRedirects","maxTechnicalRetries"],"properties":{"version":{"const":"july-sequential-legacy-first-valid/1.1.0"},"concurrency":{"const":1},"firstValidResponsePinned":{"const":true},"minimumPauseMs":{"const":5000},"timeoutMs":{"const":20000},"maxBytes":{"const":5000000},"maxRedirects":{"const":2},"maxTechnicalRetries":{"const":1}}},
    "parserVersions":{"type":"object","required":["forebet","statarea"],"properties":{"forebet":{"const":"forebet-ou25-es/1.0.0"},"statarea":{"const":"statarea-legacy-daily-raw/1.0.0"}}},
    "sourcePresentations":{"type":"object","required":["forebet","statarea","statareaEndpointTemplate","modernEvidence"],"properties":{"forebet":{"const":"CONTROLLED"},"statarea":{"const":"LEGACY_OFFICIAL"},"statareaEndpointTemplate":{"const":"https://old.statarea.com/predictions/YYYY-MM-DD"},"modernEvidence":{"const":"PRESERVED_OUTSIDE_DATASET"}}},
    "matcher":{"type":"object","required":["matcherVersion","normalizerVersion","configurationHash","aliasesAdded"],"properties":{"matcherVersion":{"const":"ou25-fixture-matcher/1.0.0"},"normalizerVersion":{"const":"ou25-identity-normalizer/1.0.0"},"configurationHash":{"const":"b659064ddf02ce1c14bb30f40db4dd3609258f51e7639e380ac020ab2787e90b"},"aliasesAdded":{"const":0}}},
    "days":{"type":"array","minItems":21,"maxItems":21,"items":{"$ref":"#/$defs/day"}},"totals":{"type":"object"},"structuralRetention":{"type":"object"},"concentration":{"type":"object"},"quality":{"type":"object","required":["resultsPersisted","statarea25SemanticStatus","statarea25OperationallyActivated"],"properties":{"resultsPersisted":{"const":false},"statarea25SemanticStatus":{"const":"STRUCTURALLY_MAPPED_WITH_LABEL_EVIDENCE"},"statarea25OperationallyActivated":{"const":false}}},"warnings":{"type":"array","items":{"type":"string","maxLength":300}},"generatedAt":{"type":"string","format":"date-time"},"manifestHash":{"type":"string","pattern":"^[a-f0-9]{64}$"}
  },
  "$defs":{"hash":{"type":"string","pattern":"^[a-f0-9]{64}$"},"forebet":{"type":"object","additionalProperties":false,"required":["source","id","sha256","parserVersion"],"properties":{"source":{"const":"FOREBET"},"id":{"type":"string"},"sha256":{"$ref":"#/$defs/hash"},"parserVersion":{"const":"forebet-ou25-es/1.0.0"}}},"statarea":{"type":"object","additionalProperties":false,"required":["source","sourcePresentation","profileId","id","sha256","parserVersion","endpoint"],"properties":{"source":{"const":"STATAREA"},"sourcePresentation":{"const":"LEGACY_OFFICIAL"},"profileId":{"type":"string"},"id":{"type":"string"},"sha256":{"$ref":"#/$defs/hash"},"parserVersion":{"const":"statarea-legacy-daily-raw/1.0.0"},"endpoint":{"type":"string","pattern":"^https://old\\.statarea\\.com/predictions/2026-07-[0-9]{2}$"}}},"day":{"type":"object","additionalProperties":false,"required":["sportsDate","partition","sourceSnapshots","sourceCounts","matchRun","matchCounts","coverage","qualityStatus","warnings"],"properties":{"sportsDate":{"type":"string","format":"date"},"partition":{"enum":["DISCOVERY","VALIDATION"]},"sourceSnapshots":{"type":"object","additionalProperties":false,"required":["forebet","statarea"],"properties":{"forebet":{"$ref":"#/$defs/forebet"},"statarea":{"$ref":"#/$defs/statarea"}}},"sourceCounts":{"type":"object"},"matchRun":{"type":"object","required":["id","matcherVersion","normalizerVersion","configurationHash"],"properties":{"id":{"type":"string"},"matcherVersion":{"const":"ou25-fixture-matcher/1.0.0"},"normalizerVersion":{"const":"ou25-identity-normalizer/1.0.0"},"configurationHash":{"const":"b659064ddf02ce1c14bb30f40db4dd3609258f51e7639e380ac020ab2787e90b"}}},"matchCounts":{"type":"object"},"coverage":{"type":"object"},"qualityStatus":{"enum":["COMPLETE","PARTIAL","EMPTY_VALID"]},"warnings":{"type":"array"}}}}
}
