{"contractVersion":"1.0","dataset":{"id":"dataset","code":"OU25-JULY-2026-V1","version":"1.0.0","status":"FROZEN"},"periods":{"from":"2026-07-01","to":"2026-07-21","discovery":{"from":"2026-07-01","to":"2026-07-14"},"validation":{"from":"2026-07-15","to":"2026-07-21"}},"capturePolicy":{"version":"july-sequential-legacy-first-valid/1.1.0","concurrency":1,"firstValidResponsePinned":true,"minimumPauseMs":5000,"timeoutMs":20000,"maxBytes":5000000,"maxRedirects":2,"maxTechnicalRetries":1},"parserVersions":{"forebet":"forebet-ou25-es/1.0.0","statarea":"statarea-legacy-daily-raw/1.0.0"},"matcher":{"matcherVersion":"ou25-fixture-matcher/1.0.0","normalizerVersion":"ou25-identity-normalizer/1.0.0","configurationHash":"b659064ddf02ce1c14bb30f40db4dd3609258f51e7639e380ac020ab2787e90b","aliasesAdded":0},"days":[{"sportsDate":"2026-07-01","partition":"DISCOVERY","sourceSnapshots":{"forebet":{"source":"FOREBET","id":"f0","sha256":"aaaaaaaaaaaaaaaaaaaaaaaaaaaaaaaaaaaaaaaaaaaaaaaaaaaaaaaaaaaaaaaa","parserVersion":"forebet-ou25-es/1.0.0"},"statarea":{"source":"STATAREA","sourcePresentation":"LEGACY_OFFICIAL","profileId":"profile-2026-07-01","id":"s0","sha256":"aaaaaaaaaaaaaaaaaaaaaaaaaaaaaaaaaaaaaaaaaaaaaaaaaaaaaaaaaaaaaaaa","parserVersion":"statarea-legacy-daily-raw/1.0.0","endpoint":"https://old.statarea.com/predictions/2026-07-01"}},"sourceCounts":{"forebet":{"found":1,"valid":1,"rejected":0,"warnings":0},"statarea":{"found":1,"valid":1,"rejected":0,"warnings":0,"unverifiedColumns":5}},"matchRun":{"id":"r0","matcherVersion":"ou25-fixture-matcher/1.0.0","normalizerVersion":"ou25-identity-normalizer/1.0.0","configurationHash":"b659064ddf02ce1c14bb30f40db4dd3609258f51e7639e380ac020ab2787e90b"},"matchCounts":{"matched":1,"ambiguous":0,"onlyForebet":0,"onlyStatarea":0,"conflict":0,"exact":1,"conservative":0,"approximate":0},"coverage":{"forebet":1,"statarea":1},"qualityStatus":"COMPLETE","warnings":[]},{"sportsDate":"2026-07-02","partition":"DISCOVERY","sourceSnapshots":{"forebet":{"source":"FOREBET","id":"f1","sha256":"aaaaaaaaaaaaaaaaaaaaaaaaaaaaaaaaaaaaaaaaaaaaaaaaaaaaaaaaaaaaaaaa","parserVersion":"forebet-ou25-es/1.0.0"},"statarea":{"source":"STATAREA","sourcePresentation":"LEGACY_OFFICIAL","profileId":"profile-2026-07-02","id":"s1","sha256":"aaaaaaaaaaaaaaaaaaaaaaaaaaaaaaaaaaaaaaaaaaaaaaaaaaaaaaaaaaaaaaaa","parserVersion":"statarea-legacy-daily-raw/1.0.0","endpoint":"https://old.statarea.com/predictions/2026-07-02"}},"sourceCounts":{"forebet":{"found":1,"valid":1,"rejected":0,"warnings":0},"statarea":{"found":1,"valid":1,"rejected":0,"warnings":0,"unverifiedColumns":5}},"matchRun":{"id":"r1","matcherVersion":"ou25-fixture-matcher/1.0.0","normalizerVersion":"ou25-identity-normalizer/1.0.0","configurationHash":"b659064ddf02ce1c14bb30f40db4dd3609258f51e7639e380ac020ab2787e90b"},"matchCounts":{"matched":1,"ambiguous":0,"onlyForebet":0,"onlyStatarea":0,"conflict":0,"exact":1,"conservative":0,"approximate":0},"coverage":{"forebet":1,"statarea":1},"qualityStatus":"COMPLETE","warnings":[]},{"sportsDate":"2026-07-03","partition":"DISCOVERY","sourceSnapshots":{"forebet":{"source":"FOREBET","id":"f2","sha256":"aaaaaaaaaaaaaaaaaaaaaaaaaaaaaaaaaaaaaaaaaaaaaaaaaaaaaaaaaaaaaaaa","parserVersion":"forebet-ou25-es/1.0.0"},"statarea":{"source":"STATAREA","sourcePresentation":"LEGACY_OFFICIAL","profileId":"profile-2026-07-03","id":"s2","sha256":"aaaaaaaaaaaaaaaaaaaaaaaaaaaaaaaaaaaaaaaaaaaaaaaaaaaaaaaaaaaaaaaa","parserVersion":"statarea-legacy-daily-raw/1.0.0","endpoint":"https://old.statarea.com/predictions/2026-07-03"}},"sourceCounts":{"forebet":{"found":1,"valid":1,"rejected":0,"warnings":0},"statarea":{"found":1,"valid":1,"rejected":0,"warnings":0,"unverifiedColumns":5}},"matchRun":{"id":"r2","matcherVersion":"ou25-fixture-matcher/1.0.0","normalizerVersion":"ou25-identity-normalizer/1.0.0","configurationHash":"b659064ddf02ce1c14bb30f40db4dd3609258f51e7639e380ac020ab2787e90b"},"matchCounts":{"matched":1,"ambiguous":0,"onlyForebet":0,"onlyStatarea":0,"conflict":0,"exact":1,"conservative":0,"approximate":0},"coverage":{"forebet":1,"statarea":1},"qualityStatus":"COMPLETE","warnings":[]},{"sportsDate":"2026-07-04","partition":"DISCOVERY","sourceSnapshots":{"forebet":{"source":"FOREBET","id":"f3","sha256":"aaaaaaaaaaaaaaaaaaaaaaaaaaaaaaaaaaaaaaaaaaaaaaaaaaaaaaaaaaaaaaaa","parserVersion":"forebet-ou25-es/1.0.0"},"statarea":{"source":"STATAREA","sourcePresentation":"LEGACY_OFFICIAL","profileId":"profile-2026-07-04","id":"s3","sha256":"aaaaaaaaaaaaaaaaaaaaaaaaaaaaaaaaaaaaaaaaaaaaaaaaaaaaaaaaaaaaaaaa","parserVersion":"statarea-legacy-daily-raw/1.0.0","endpoint":"https://old.statarea.com/predictions/2026-07-04"}},"sourceCounts":{"forebet":{"found":1,"valid":1,"rejected":0,"warnings":0},"statarea":{"found":1,"valid":1,"rejected":0,"warnings":0,"unverifiedColumns":5}},"matchRun":{"id":"r3","matcherVersion":"ou25-fixture-matcher/1.0.0","normalizerVersion":"ou25-identity-normalizer/1.0.0","configurationHash":"b659064ddf02ce1c14bb30f40db4dd3609258f51e7639e380ac020ab2787e90b"},"matchCounts":{"matched":1,"ambiguous":0,"onlyForebet":0,"onlyStatarea":0,"conflict":0,"exact":1,"conservative":0,"approximate":0},"coverage":{"forebet":1,"statarea":1},"qualityStatus":"COMPLETE","warnings":[]},{"sportsDate":"2026-07-05","partition":"DISCOVERY","sourceSnapshots":{"forebet":{"source":"FOREBET","id":"f4","sha256":"aaaaaaaaaaaaaaaaaaaaaaaaaaaaaaaaaaaaaaaaaaaaaaaaaaaaaaaaaaaaaaaa","parserVersion":"forebet-ou25-es/1.0.0"},"statarea":{"source":"STATAREA","sourcePresentation":"LEGACY_OFFICIAL","profileId":"profile-2026-07-05","id":"s4","sha256":"aaaaaaaaaaaaaaaaaaaaaaaaaaaaaaaaaaaaaaaaaaaaaaaaaaaaaaaaaaaaaaaa","parserVersion":"statarea-legacy-daily-raw/1.0.0","endpoint":"https://old.statarea.com/predictions/2026-07-05"}},"sourceCounts":{"forebet":{"found":1,"valid":1,"rejected":0,"warnings":0},"statarea":{"found":1,"valid":1,"rejected":0,"warnings":0,"unverifiedColumns":5}},"matchRun":{"id":"r4","matcherVersion":"ou25-fixture-matcher/1.0.0","normalizerVersion":"ou25-identity-normalizer/1.0.0","configurationHash":"b659064ddf02ce1c14bb30f40db4dd3609258f51e7639e380ac020ab2787e90b"},"matchCounts":{"matched":1,"ambiguous":0,"onlyForebet":0,"onlyStatarea":0,"conflict":0,"exact":1,"conservative":0,"approximate":0},"coverage":{"forebet":1,"statarea":1},"qualityStatus":"COMPLETE","warnings":[]},{"sportsDate":"2026-07-06","partition":"DISCOVERY","sourceSnapshots":{"forebet":{"source":"FOREBET","id":"f5","sha256":"aaaaaaaaaaaaaaaaaaaaaaaaaaaaaaaaaaaaaaaaaaaaaaaaaaaaaaaaaaaaaaaa","parserVersion":"forebet-ou25-es/1.0.0"},"statarea":{"source":"STATAREA","sourcePresentation":"LEGACY_OFFICIAL","profileId":"profile-2026-07-06","id":"s5","sha256":"aaaaaaaaaaaaaaaaaaaaaaaaaaaaaaaaaaaaaaaaaaaaaaaaaaaaaaaaaaaaaaaa","parserVersion":"statarea-legacy-daily-raw/1.0.0","endpoint":"https://old.statarea.com/predictions/2026-07-06"}},"sourceCounts":{"forebet":{"found":1,"valid":1,"rejected":0,"warnings":0},"statarea":{"found":1,"valid":1,"rejected":0,"warnings":0,"unverifiedColumns":5}},"matchRun":{"id":"r5","matcherVersion":"ou25-fixture-matcher/1.0.0","normalizerVersion":"ou25-identity-normalizer/1.0.0","configurationHash":"b659064ddf02ce1c14bb30f40db4dd3609258f51e7639e380ac020ab2787e90b"},"matchCounts":{"matched":1,"ambiguous":0,"onlyForebet":0,"onlyStatarea":0,"conflict":0,"exact":1,"conservative":0,"approximate":0},"coverage":{"forebet":1,"statarea":1},"qualityStatus":"COMPLETE","warnings":[]},{"sportsDate":"2026-07-07","partition":"DISCOVERY","sourceSnapshots":{"forebet":{"source":"FOREBET","id":"f6","sha256":"aaaaaaaaaaaaaaaaaaaaaaaaaaaaaaaaaaaaaaaaaaaaaaaaaaaaaaaaaaaaaaaa","parserVersion":"forebet-ou25-es/1.0.0"},"statarea":{"source":"STATAREA","sourcePresentation":"LEGACY_OFFICIAL","profileId":"profile-2026-07-07","id":"s6","sha256":"aaaaaaaaaaaaaaaaaaaaaaaaaaaaaaaaaaaaaaaaaaaaaaaaaaaaaaaaaaaaaaaa","parserVersion":"statarea-legacy-daily-raw/1.0.0","endpoint":"https://old.statarea.com/predictions/2026-07-07"}},"sourceCounts":{"forebet":{"found":1,"valid":1,"rejected":0,"warnings":0},"statarea":{"found":1,"valid":1,"rejected":0,"warnings":0,"unverifiedColumns":5}},"matchRun":{"id":"r6","matcherVersion":"ou25-fixture-matcher/1.0.0","normalizerVersion":"ou25-identity-normalizer/1.0.0","configurationHash":"b659064ddf02ce1c14bb30f40db4dd3609258f51e7639e380ac020ab2787e90b"},"matchCounts":{"matched":1,"ambiguous":0,"onlyForebet":0,"onlyStatarea":0,"conflict":0,"exact":1,"conservative":0,"approximate":0},"coverage":{"forebet":1,"statarea":1},"qualityStatus":"COMPLETE","warnings":[]},{"sportsDate":"2026-07-08","partition":"DISCOVERY","sourceSnapshots":{"forebet":{"source":"FOREBET","id":"f7","sha256":"aaaaaaaaaaaaaaaaaaaaaaaaaaaaaaaaaaaaaaaaaaaaaaaaaaaaaaaaaaaaaaaa","parserVersion":"forebet-ou25-es/1.0.0"},"statarea":{"source":"STATAREA","sourcePresentation":"LEGACY_OFFICIAL","profileId":"profile-2026-07-08","id":"s7","sha256":"aaaaaaaaaaaaaaaaaaaaaaaaaaaaaaaaaaaaaaaaaaaaaaaaaaaaaaaaaaaaaaaa","parserVersion":"statarea-legacy-daily-raw/1.0.0","endpoint":"https://old.statarea.com/predictions/2026-07-08"}},"sourceCounts":{"forebet":{"found":1,"valid":1,"rejected":0,"warnings":0},"statarea":{"found":1,"valid":1,"rejected":0,"warnings":0,"unverifiedColumns":5}},"matchRun":{"id":"r7","matcherVersion":"ou25-fixture-matcher/1.0.0","normalizerVersion":"ou25-identity-normalizer/1.0.0","configurationHash":"b659064ddf02ce1c14bb30f40db4dd3609258f51e7639e380ac020ab2787e90b"},"matchCounts":{"matched":1,"ambiguous":0,"onlyForebet":0,"onlyStatarea":0,"conflict":0,"exact":1,"conservative":0,"approximate":0},"coverage":{"forebet":1,"statarea":1},"qualityStatus":"COMPLETE","warnings":[]},{"sportsDate":"2026-07-09","partition":"DISCOVERY","sourceSnapshots":{"forebet":{"source":"FOREBET","id":"f8","sha256":"aaaaaaaaaaaaaaaaaaaaaaaaaaaaaaaaaaaaaaaaaaaaaaaaaaaaaaaaaaaaaaaa","parserVersion":"forebet-ou25-es/1.0.0"},"statarea":{"source":"STATAREA","sourcePresentation":"LEGACY_OFFICIAL","profileId":"profile-2026-07-09","id":"s8","